source,author,title,description,url,urlToImage,publishedAt,content,date,sentiment_label,sentiment_score
"{'id': 'the-times-of-india', 'name': 'The Times of India'}",Nikhil Agarwal,Retail investors dump 68% of Nifty stocks chasing smallcap crorepati dreams. Is this a trap?,Indian retail investors are selling their holdings in Nifty50 companies. They are seeking higher returns in small and mid-cap stocks. This trend is driven by impatience and the desire for quick profits. Experts warn against this strategy. They cite risks like…,https://economictimes.indiatimes.com/markets/stocks/news/retail-investors-dump-68-of-nifty-stocks-chasing-smallcap-crorepati-dreams-is-this-a-trap/articleshow/123085733.cms,"https://img.etimg.com/thumb/msid-123085718,width-1200,height-630,imgsize-63230,overlay-etmarkets/articleshow.jpg",2025-08-04 03:38:40+00:00,"In a high-stakes gamble for explosive returns, a vast army of retail investors has systematically shedded its holdings in Indias most formidable bluechip companies. Driven by a potent cocktail of imp… [+8113 chars]",2025-08-04,positive,0.9296418726444244
"{'id': 'the-times-of-india', 'name': 'The Times of India'}",ET CONTRIBUTORS,"Nifty Weekly Outlook: Reversal confirmed, big moves expected around August 8, says Harshubh Shah","The Indian equity market ended its fifth straight week in the red, with the Nifty50 falling over 1%. July 29 marked a crucial reversal point amid sustained FPI outflows. Technical and time-based signals aligned well, offering trading cues. August 8 and 11 are…",https://economictimes.indiatimes.com/markets/stocks/news/nifty-weekly-outlook-reversal-confirmed-big-moves-expected-around-august-8-says-harshubh-shah/articleshow/123072482.cms,"https://img.etimg.com/thumb/msid-123072489,width-1200,height-630,imgsize-80448,overlay-etmarkets/articleshow.jpg",2025-08-03 06:00:33+00:00,"The Indian equity market ended the week through August 1, 2025, on a cautious note, marking its fifth consecutive weekly loss.The Nifty50 index fell over 1% during the week, despite a midweek rebound… [+3575 chars]",2025-08-03,negative,-0.9998251738506951
"{'id': None, 'name': 'BusinessLine'}",Aarati Krishnan,"‘We bet on high-growth optionalities, but restrict our weights’: Rupesh Patel of Nippon Mutual Fund","The fund manager talks about scheme performance, the small- and mid-cap universe, equity returns in India and more",https://www.thehindubusinessline.com/portfolio/personal-finance/we-bet-on-high-growth-optionalities-but-restrict-our-weights-rupesh-patel-of-nippon-mutual-fund/article69882855.ece,https://bl-i.thgim.com/public/incoming/wrhvqz/article69882918.ece/alternates/LANDSCAPE_1200/Rupesh%20Patel.jpg,2025-08-02 12:34:59+00:00,Nippon India has minted quite a few wealthy retail investors with the Nippon India Growth Fund achieving  a 22 per cent CAGR (Compounded Annual Growth Rate) over its nearly  30-year history. We spoke… [+8533 chars],2025-08-02,negative,-0.9981228922843002
"{'id': 'the-times-of-india', 'name': 'The Times of India'}",ETMarkets.com,"Sensex falls over 250 pts, Nifty below 24,750 as Trump tariffs keep investors on edge","Indian benchmark indices Sensex and Nifty50 opened lower on Friday following the U.S. imposition of steep tariffs on several trading partners, including reaffirming a 25% duty on imports from India. Investors viewed the tariff announcement as a pressure tacti…",https://economictimes.indiatimes.com/markets/stocks/news/sensex-falls-over-250-pts-nifty-below-24750-as-trump-tariffs-keep-investors-on-edge/articleshow/123034194.cms,"https://img.etimg.com/thumb/msid-123034297,width-1200,height-630,imgsize-86810,overlay-etmarkets/articleshow.jpg",2025-08-01 03:59:03+00:00,"Indian benchmark indices Sensex and Nifty50 opened lower on Friday as the U.S. imposed steep tariffs on several trading partners and reaffirmed a 25% duty on imports from India.At around 9:20 am, the… [+2626 chars]",2025-08-01,neutral,0.4490545801818371
"{'id': None, 'name': 'BusinessLine'}",BL Research Bureau,"Day Trading Guide for August 1, 2025: Intraday supports, resistances for Nifty50 stocks","Day Trading Guide gives you the key intraday supports and resistances to watch out for on the Nifty Futures and other widely traded stocks such as Reliance Industries, Infosys, HDFC Bank, TCS, SBI",https://www.thehindubusinessline.com/portfolio/day-trading-guide/day-trading-guide-for-august-01/article69878525.ece,https://bl-i.thgim.com/public/incoming/r2n0nd/article69652544.ece/alternates/LANDSCAPE_1200/IMG_PO12_Buy_or_Sell_2_1_FODE0G6B.jpg,2025-08-01 00:46:00+00:00,"Day Trading Guide gives you the key intraday supports and resistances to watch out for on the Nifty Futures and other widely traded stocks such as Reliance Industries, Infosys, HDFC Bank, TCS, SBI. B… [+2390 chars]",2025-08-01,negative,-0.9999937599980058
"{'id': None, 'name': 'Economictimes.com'}",ET Spotlight Special,"Breakout Stocks: How to trade Schneider Electric, GE Vernova & Navin Fluorine that hit 52-week high?","Indian markets recovered partially on Thursday but closed lower, with the Sensex down nearly 300 points and Nifty50 below 24,800. FMCG stocks gained while healthcare, metals, oil & gas, and telecom saw selling. Schneider Electric hit a 52-week high.",https://m.economictimes.com/markets/stocks/news/breakout-stocks-how-to-trade-schneider-electric-ge-vernova-amp-navin-fluorine-that-hit-52-week-high/market-summary/slideshow/123020771.cms,"https://img.etimg.com/thumb/msid-123020771,width-1070,height-580,overlay-etmarkets/slideshow.jpg",2025-07-31 12:06:53+00:00,"Schneider Electric has broken out of its previous swing high and entered all-time high levels. The upside resistance is now at 1,061, with support at 860.
(Disclaimer: Recommendations, suggestions, … [+106 chars]",2025-07-31,negative,-0.9999728314251115
"{'id': 'the-times-of-india', 'name': 'The Times of India'}",ETMarkets.com,D-Street investors lose over Rs 5 lakh crore in 15 mins as Sensex tumbles 600 pts on Trump’s tariff move,"Indian benchmark indices experienced a sharp decline on Thursday morning following President Trump's threat to impose a 25% tariff on Indian goods starting August 1, coupled with an unspecified penalty. The BSE Sensex fell by 0.74% and the Nifty50 dropped by …",https://economictimes.indiatimes.com/markets/stocks/news/d-street-investors-lose-over-rs-5-lakh-crore-in-15-mins-as-sensex-tumbles-600-pts-on-trumps-tariff-move/articleshow/123010479.cms,"https://img.etimg.com/thumb/msid-123010508,width-1200,height-630,imgsize-113268,overlay-etmarkets/articleshow.jpg",2025-07-31 04:04:08+00:00,"Indian benchmark indices opened sharply lower on Thursday after U.S. President Donald Trump threatened to impose a 25% tariff on goods imported from India starting August 1, along with an unspecified… [+1125 chars]",2025-07-31,positive,0.978675976395607
"{'id': 'the-times-of-india', 'name': 'The Times of India'}",Kshitij Anand,ETMarkets Smart Talk| 15 sectors to watch: From EMS to aerospace engineering - Sunny Agrawal maps the opportunity landscape,"Amidst volatile markets and global trade uncertainties, smart money is shifting beyond benchmark indices, focusing on high-potential sectors like EMS, auto ancillaries, and aerospace engineering. Despite tepid earnings expectations in some sectors, areas like…",https://economictimes.indiatimes.com/markets/expert-view/etmarkets-smart-talk-15-sectors-to-watch-from-ems-to-aerospace-engineering-sunny-agrawal-maps-the-opportunity-landscape/articleshow/122991269.cms,"https://img.etimg.com/thumb/msid-122991255,width-1200,height-630,imgsize-19932,overlay-etmarkets/articleshow.jpg",2025-07-31 03:30:00+00:00,"In this edition of ETMarkets Smart Talk, Sunny Agrawal, Head of Fundamental Research at SBI Securities, shares his insights on navigating the current volatile market landscape.As global trade uncerta… [+7478 chars]",2025-07-31,negative,-0.9999634500290995
"{'id': None, 'name': 'BusinessLine'}",BL Research Bureau,"Day Trading Guide for 31 July, 2025: Intraday supports, resistances for Nifty50 stocks","Day Trading Guide gives you the key intraday supports and resistances to watch out for on the Nifty Futures and other widely traded stocks such as Reliance Industries, Infosys, HDFC Bank, TCS, SBI",https://www.thehindubusinessline.com/portfolio/day-trading-guide/day-trading-guide-for-july-31/article69873670.ece,https://bl-i.thgim.com/public/incoming/84khnm/article69711880.ece/alternates/LANDSCAPE_1200/PO16_Buy_sell_dice.jpg,2025-07-31 00:30:00+00:00,"Day Trading Guide gives you the key intraday supports and resistances to watch out for on the Nifty Futures and other widely traded stocks such as Reliance Industries, Infosys, HDFC Bank, TCS, SBI. B… [+2337 chars]",2025-07-31,negative,-0.9999958470389174
"{'id': None, 'name': 'Economictimes.com'}",TIL Creatives,"Breakout Stocks: How to trade Hitachi Energy, Sumitomo Chemical & GE Vernova that hit fresh 52-week high?","​Indian market closed in the green for the second consecutive day in a row on Wednesday. The BSE Sensex rose more than 100 points while the Nifty50 closed above 24800 levels. Sectorally, buying was seen in FMCG, capital goods, consumer durable and IT stocks w…",https://m.economictimes.com/markets/stocks/news/breakout-stocks-how-to-trade-hitachi-energy-sumitomo-chemical-amp-ge-vernova-that-hit-fresh-52-week-high/market-summary/slideshow/122997239.cms,"https://img.etimg.com/thumb/msid-122997239,width-1070,height-580,overlay-etmarkets/slideshow.jpg",2025-07-30 11:12:04+00:00,"Hitachi Energy has delivered a clean breakout above the Rs 20,200 level with volume support.
If the breakout sustains, the stock may continue its upward journey. However, failure to hold above Rs 20… [+135 chars]",2025-07-30,negative,-0.9998906068976794
"{'id': 'the-times-of-india', 'name': 'The Times of India'}",ETMarkets.com,"Sensex opens flat, Nifty tops 24,800 amid US trade deal uncertainty","Indian stock markets began Wednesday with positive momentum, fueled by robust earnings from Larsen & Toubro, boosting investor confidence. However, the upward movement was limited as investors exercised caution in anticipation of the U.S. Federal Reserve's up…",https://economictimes.indiatimes.com/markets/stocks/news/sensex-opens-flat-nifty-tops-24800-amid-us-trade-deal-uncertainty/articleshow/122988159.cms,"https://img.etimg.com/thumb/msid-122988118,width-1200,height-630,imgsize-16174,overlay-etmarkets/articleshow.jpg",2025-07-30 04:02:28+00:00,"Indian equity benchmarks opened flat on Wednesday, supported by strong earnings from infrastructure major Larsen &amp; Toubro, which lifted market sentiment. However, gains remained limited amid caut… [+1448 chars]",2025-07-30,negative,-0.4041445553302765
"{'id': None, 'name': 'BusinessLine'}",BL Research Bureau,"Day Trading Guide for 30 July, 2025: Intraday supports, resistances for Nifty50 stocks","Day Trading Guide gives you the key intraday supports and resistances to watch out for on the Nifty Futures and other widely traded stocks such as Reliance Industries, Infosys, HDFC Bank, TCS, SBI",https://www.thehindubusinessline.com/portfolio/day-trading-guide/day-trading-guide-for-july-30/article69869204.ece,https://bl-i.thgim.com/public/incoming/9dyc05/article66812369.ece/alternates/LANDSCAPE_1200/buy-hold-sell.jpg,2025-07-30 00:56:00+00:00,"Day Trading Guide gives you the key intraday supports and resistances to watch out for on the Nifty Futures and other widely traded stocks such as Reliance Industries, Infosys, HDFC Bank, TCS, SBI. B… [+2333 chars]",2025-07-30,negative,-0.9999958394146233
"{'id': None, 'name': 'Ndtvprofit.com'}",NDTV Profit News,"Sterlite Technologies Targets 18–20% Ebitda Margin In FY26, Led By Enhanced Capacity Utilisation",The company wants to take its factory utilisation to over 70% in FY26 from 45-50% currently.,https://www.ndtvprofit.com/quarterly-earnings/sterlite-technologies-targets-1820-ebitda-margin-in-fy26-led-by-enhanced-capacity-utilisation,https://media.assettype.com/bloombergquint%2F2024-10-30%2F3etecweh%2FSterlite%20Technologies%20Ltd.%20a%20leading%20global%20optical%20fiber%20cable%20and%20digital%20solutions%20company%20in%20Aurangabad%20(Photo%20Vijay%20Sartape%20BQ%20Prime)%20(2).jpeg?w=1200&auto=format%2Ccompress&ogImage=true,2025-07-30 00:47:34+00:00,"Agarwal identified data centres as a critical growth area, with Indias data centre capacity projected to triple from one gigawatt to three gigawatts by 2030. Sterlite Technologies has launched a dedi… [+1522 chars]",2025-07-30,neutral,-7.289589820658193e-09
"{'id': 'the-times-of-india', 'name': 'The Times of India'}",Riya Sharma,Ahead of Market: 10 things that will decide stock market action on Wednesday,"Indian markets rebounded on Tuesday, ending a three-day losing streak, driven by value buying in Reliance and HDFC Bank. Broader sentiment remained cautious due to FPI outflows and US trade deal uncertainty. Most sectors ended higher, led by metals and pharma.",https://economictimes.indiatimes.com/markets/stocks/news/ahead-of-market-10-things-that-will-decide-stock-market-action-on-wednesday/articleshow/122979681.cms,"https://img.etimg.com/thumb/msid-122979703,width-1200,height-630,imgsize-110642,overlay-etmarkets/articleshow.jpg",2025-07-29 15:32:34+00:00,"The Indian market ended in the green on Tuesday, snapping a three-day losing streak, as value buying in blue-chip names like Reliance Industries and HDFC Bank buoyed sentiment and tempered concerns o… [+5795 chars]",2025-07-29,negative,-0.9999958269321496
"{'id': 'the-times-of-india', 'name': 'The Times of India'}",ETMarkets.com,"Sensex falls over 100 pts, Nifty below 24,700 amid US trade deal jitters","Indian equity benchmarks experienced a decline for the fourth consecutive session, influenced by uncertainties surrounding a delayed interim trade agreement with the U.S. and continuous foreign fund outflows. Weak corporate earnings further contributed to the…",https://economictimes.indiatimes.com/markets/stocks/news/sensex-falls-over-100-pts-nifty-below-24700-amid-us-trade-deal-jitters/articleshow/122965372.cms,"https://img.etimg.com/thumb/msid-122965319,width-1200,height-630,imgsize-16172,overlay-etmarkets/articleshow.jpg",2025-07-29 03:57:11+00:00,"Indian equity benchmarks opened lower for the fourth consecutive session on Tuesday, weighed down by uncertainty over a delayed interim trade deal with the United States, continued foreign fund outfl… [+4021 chars]",2025-07-29,positive,0.9603554401546717
"{'id': 'the-times-of-india', 'name': 'The Times of India'}",Nikhil Agarwal,"Trent, TCS shares worst Nifty performers in 2025. Why 2 Tata stocks are down at least 25% this year","Trent’s sharp growth slowdown has prompted analyst downgrades. Nuvama cut the stock to ‘Hold’ and slashed its FY26/27 estimates and target price. HSBC trimmed its target too, citing a weaker-than-expected Q1. With both Trent and TCS under pressure, the Tata G…",https://economictimes.indiatimes.com/markets/stocks/news/trent-tcs-shares-worst-nifty-performers-in-2025-why-2-tata-stocks-are-down-at-least-25-this-year/articleshow/122965483.cms,"https://img.etimg.com/thumb/msid-122965465,width-1200,height-630,imgsize-4140,overlay-etmarkets/articleshow.jpg",2025-07-29 03:52:26+00:00,"Blue-chip stocks Trent and TCS, incidentally, both part of the revered Tata Group, have each lost over 25% so far in 2025, making them the worst-performing Nifty50 stocks this year. While IT giant TC… [+4610 chars]",2025-07-29,positive,0.9999853138106118
"{'id': None, 'name': 'Ndtvprofit.com'}",NDTV Profit News,Laurus Labs Targets 55-60% Gross Margin In FY26 On CDMO Expansion,"Laurus Labs is targeting gross margins of 55% to 60% in FY26, led by an increase in revenue generated from the Contract Development and Manufacturing Organisation (CDMO) business. Speaking to NDTV Profit on Monday, the leading pharma company’s founder and CEO…",https://www.ndtvprofit.com/quarterly-earnings/laurus-labs-targets-55-60-gross-margin-in-fy26-on-cdmo-expansion,https://media.assettype.com/bloombergquint%2F2024-01%2F3d71cc7e-4711-4449-8db0-80c53b5e6a6a%2FLaurus_Labs_X.jfif?w=1200&auto=format%2Ccompress&ogImage=true,2025-07-29 01:13:31+00:00,"Highlighting the trajectory of the growth of CDMO revenue, he said the business vertical has grown from Rs 500 crore in FY21 to Rs 500 crore per quarter currently.
When asked about the potential for… [+1057 chars]",2025-07-29,neutral,-2.0523516344184145e-06
"{'id': None, 'name': 'BusinessLine'}",BL Research Bureau,"Day Trading Guide for 29 July, 2025: Intraday supports, resistances for Nifty50 stocks","Day Trading Guide gives you the key intraday supports and resistances to watch out for on the Nifty Futures and other widely traded stocks such as Reliance Industries, Infosys, HDFC Bank, TCS and SBI.",https://www.thehindubusinessline.com/portfolio/day-trading-guide/day-trading-guide-for-july-29/article69865191.ece,https://bl-i.thgim.com/public/incoming/u10keh/article69266039.ece/alternates/LANDSCAPE_1200/CCI_UDHindu_KSL_U8R45AOOD_R1528725515_5_ac09a597-d8df-4552-b78b-d9fa74b25d48.jpg,2025-07-29 00:43:00+00:00,"Day Trading Guide gives you the key intraday supports and resistances to watch out for on the Nifty Futures and other widely traded stocks such as Reliance Industries, Infosys, HDFC Bank, TCS, SBI. B… [+2339 chars]",2025-07-29,negative,-0.9999960545528666
"{'id': 'the-times-of-india', 'name': 'The Times of India'}",ETMarkets.com,Stock market update: FMCG stocks down as market falls,The 30-share BSE Sensex closed  down  572.07 points at 80891.02,https://economictimes.indiatimes.com/markets/stocks/stock-watch/stock-market-update-fmcg-stocks-down-as-market-falls/articleshow/122953767.cms,"https://img.etimg.com/thumb/msid-81699096,width-1200,height-630,imgsize-194573,overlay-etmarkets/articleshow.jpg",2025-07-28 11:46:32+00:00,"NEW DELHI: FMCG shares closed lower in the Monday's session. Tasty Bite Eatables Ltd.(up 6.15%), Prataap Snacks Ltd.(up 4.11%), Dabur India Ltd.(up 2.09%), Varun Beverages Ltd.(up 2.02%), Hindustan U… [+1574 chars]",2025-07-28,positive,0.9651656225323677
"{'id': None, 'name': 'Economictimes.com'}",ET Online,"Breakout Stocks: How to trade Laurus Labs, Torrent Pharma and Fortis Healthcare that hit a fresh 52-week high?","Indian market closed in the red for the third consecutive day in a row on Monday. The BSE Sensex fell more than 500 points while the Nifty50 closed below 24700.​Stocks that hit a fresh 52-week high include names like Laurus Labs, which rose more than 6%, Torr…",https://m.economictimes.com/markets/stocks/news/breakout-stocks-how-to-trade-laurus-labs-torrent-pharma-and-fortis-healthcare-that-hit-a-fresh-52-week-high/market-summary/slideshow/122953629.cms,"https://img.etimg.com/thumb/msid-122953629,width-1070,height-580,overlay-etmarkets/slideshow.jpg",2025-07-28 11:35:45+00:00,"The stock gave a trendline breakout with a strong bullish green candle, gaining 51 points or 6.15% today, with volumes above the 50-day moving average.
Since the stock has given the breakout, the po… [+384 chars]",2025-07-28,negative,-0.9998026073080837
"{'id': 'the-times-of-india', 'name': 'The Times of India'}",ETMarkets.com,Stock market update: Power stocks down as market falls,The 30-share BSE Sensex closed  down  572.07 points at 80891.02,https://economictimes.indiatimes.com/markets/stocks/stock-watch/stock-market-update-power-stocks-down-as-market-falls/articleshow/122952269.cms,"https://img.etimg.com/thumb/msid-82697732,width-1200,height-630,imgsize-184256,overlay-etmarkets/articleshow.jpg",2025-07-28 10:35:47+00:00,"NEW DELHI: Power shares closed lower in the Monday's session. ACME Solar Holdings Ltd.(up 8.84%), Adani Green Energy Ltd.(up 2.87%), Karma Energy Ltd.(up 2.39%), Power and Instrumentation(Gujarat)Ltd… [+1628 chars]",2025-07-28,positive,0.9966113185510039
"{'id': 'the-times-of-india', 'name': 'The Times of India'}",ETMarkets.com,Sensex falls! But these stocks rallied over 15% on BSE in today's trade,"In the Nifty50 index, 16 stocks closed in the green, while 34 stocks ended in the red.",https://economictimes.indiatimes.com/markets/stocks/stock-watch/sensex-falls-but-these-stocks-rallied-over-15-on-bse-in-todays-trade/articleshow/122952145.cms,"https://img.etimg.com/thumb/msid-83791939,width-1200,height-630,imgsize-992893,overlay-etmarkets/articleshow.jpg",2025-07-28 10:30:24+00:00,"(What's moving Sensex and Nifty Track latest market news, stock tips, Budget 2025, Share Market on Budget 2025 and expert advice, on ETMarkets. Also, ETMarkets.com is now on Telegram. For fastest new… [+330 chars]",2025-07-28,negative,-0.9841986540704966
"{'id': 'the-times-of-india', 'name': 'The Times of India'}",ETMarkets.com,Stock market update: Power stocks up as market falls,The 30-share BSE Sensex was  down  149.73 points at 81313.36,https://economictimes.indiatimes.com/markets/stocks/stock-watch/stock-market-update-power-stocks-up-as-market-falls/articleshow/122946363.cms,"https://img.etimg.com/thumb/msid-83771694,width-1200,height-630,imgsize-185726,overlay-etmarkets/articleshow.jpg",2025-07-28 05:45:19+00:00,"NEW DELHI: Power stocks were trading higher on Monday at 11:14AM ACME Solar Holdings Ltd.(up 7.79%), Energy Development Company Ltd.(up 3.86%), Jaiprakash Power Ventures Ltd.(up 3.09%), NTPC Green En… [+1628 chars]",2025-07-28,negative,-0.780117124064418
"{'id': 'the-times-of-india', 'name': 'The Times of India'}",ETMarkets.com,Stock market update: Fertilisers stocks down as market falls,The 30-share BSE Sensex was  down  154.36 points at 81308.73,https://economictimes.indiatimes.com/markets/stocks/stock-watch/stock-market-update-fertilisers-stocks-down-as-market-falls/articleshow/122946225.cms,"https://img.etimg.com/thumb/msid-82697732,width-1200,height-630,imgsize-184256,overlay-etmarkets/articleshow.jpg",2025-07-28 05:38:58+00:00,"NEW DELHI: Fertilisers stocks were trading lower on Monday at 11:08AM Agro Phos India Ltd.(up 4.64%), Paradeep Phosphates Ltd.(up 4.62%), Mangalore Chemicals &amp; Fertilizers Ltd.(up 2.78%), Zuari A… [+1822 chars]",2025-07-28,positive,0.9194811172783375
"{'id': 'the-times-of-india', 'name': 'The Times of India'}",ETMarkets.com,Stock market update: Nifty IT index falls 0.38% in a weak market,The Nifty IT index was trading 0.38 per cent  down  at 35489.3.,https://economictimes.indiatimes.com/markets/stocks/stock-watch/stock-market-update-nifty-it-index-falls-0-38-in-a-weak-market/articleshow/122946103.cms,"https://img.etimg.com/thumb/msid-83800143,width-1200,height-630,imgsize-287158,overlay-etmarkets/articleshow.jpg",2025-07-28 05:33:09+00:00,"NEW DELHI: The Nifty IT index traded negative around 11:02AM(IST)on Monday in a weak market. MphasiS Ltd.(up 3.38 per cent), Coforge Ltd.(up 1.77 per cent), Oracle Financial Services Software Ltd.(up… [+1115 chars]",2025-07-28,positive,0.9999925317015368
"{'id': 'the-times-of-india', 'name': 'The Times of India'}",ETMarkets.com,Stock market update: Nifty Auto index advances 0.27% in a weak market,The Nifty Auto index was trading 0.27 per cent  up  at 23845.85.,https://economictimes.indiatimes.com/markets/stocks/stock-watch/stock-market-update-nifty-auto-index-advances-0-27-in-a-weak-market/articleshow/122945994.cms,"https://img.etimg.com/thumb/msid-83549420,width-1200,height-630,imgsize-22674,overlay-etmarkets/articleshow.jpg",2025-07-28 05:27:45+00:00,"NEW DELHI: The Nifty Auto index traded positive around 10:57AM(IST)on Monday in a weak market. Ashok Leyland Ltd.(up 1.69 per cent), TVS Motor Company Ltd.(up 1.43 per cent), Samvardhana Motherson In… [+1054 chars]",2025-07-28,positive,0.9999757297841825
"{'id': 'the-times-of-india', 'name': 'The Times of India'}",ETMarkets.com,Stock market update: Nifty Bank index falls 0.03% in an upbeat market,The Nifty Bank index was trading 0.03 per cent  down  at 56511.1.,https://economictimes.indiatimes.com/markets/stocks/stock-watch/stock-market-update-nifty-bank-index-falls-0-03-in-an-upbeat-market/articleshow/122945581.cms,"https://img.etimg.com/thumb/msid-83800143,width-1200,height-630,imgsize-287158,overlay-etmarkets/articleshow.jpg",2025-07-28 05:04:49+00:00,"NEW DELHI: The Nifty Bank index traded negative around 10:33AM(IST)on Monday in an upbeat market. Canara Bank(up 1.66 per cent), ICICI Bank Ltd.(up 0.88 per cent), HDFC Bank Ltd.(up 0.69 per cent), B… [+1042 chars]",2025-07-28,neutral,-0.001476798750445596
"{'id': 'the-times-of-india', 'name': 'The Times of India'}",ETMarkets.com,Stock market update: Mining stocks down as market rises,The 30-share BSE Sensex was  up  52.7 points at 81515.79,https://economictimes.indiatimes.com/markets/stocks/stock-watch/stock-market-update-mining-stocks-down-as-market-rises/articleshow/122945488.cms,"https://img.etimg.com/thumb/msid-83772708,width-1200,height-630,imgsize-284734,overlay-etmarkets/articleshow.jpg",2025-07-28 04:58:28+00:00,"NEW DELHI: Mining stocks were trading lower on Monday at 10:28AM Aro Granite Industries Ltd.(up 2.16%), The Orissa Minerals Development Company Ltd.(up 1.48%), Sandur Manganese &amp; Iron Ores Ltd.(u… [+1389 chars]",2025-07-28,positive,0.9975530233932659
"{'id': 'the-times-of-india', 'name': 'The Times of India'}",ETMarkets.com,Stock market update: FMCG stocks up as market falls,The 30-share BSE Sensex was  down  88.45 points at 81374.64,https://economictimes.indiatimes.com/markets/stocks/stock-watch/stock-market-update-fmcg-stocks-up-as-market-falls/articleshow/122945119.cms,"https://img.etimg.com/thumb/msid-83804572,width-1200,height-630,imgsize-297423,overlay-etmarkets/articleshow.jpg",2025-07-28 04:40:52+00:00,"NEW DELHI: FMCG stocks were trading higher on Monday at 10:10AM Gopal Snacks Ltd.(up 2.33%), Marico Ltd.(up 1.84%), Varun Beverages Ltd.(up 1.70%), Dodla Dairy Ltd.(up 1.43%), Colgate-Palmolive(India… [+1607 chars]",2025-07-28,negative,-0.9645015466485347
