source,author,title,description,url,urlToImage,publishedAt,content,date,sentiment_label,sentiment_score
"{'id': 'the-times-of-india', 'name': 'The Times of India'}",ETMarkets.com,Stock market update: Nifty IT index falls 0.17% in an upbeat market,The Nifty IT index was trading 0.17 per cent  down  at 36968.0.,https://economictimes.indiatimes.com/markets/stocks/stock-watch/stock-market-update-nifty-it-index-falls-0-17-in-an-upbeat-market/articleshow/122827517.cms,"https://img.etimg.com/thumb/msid-82697732,width-1200,height-630,imgsize-184256,overlay-etmarkets/articleshow.jpg",2025-07-22 04:50:05+00:00,"NEW DELHI: The Nifty IT index traded negative around 10:19AM(IST)on Tuesday in an upbeat market. Tata Consultancy Services Ltd.(up 0.19 per cent), Tech Mahindra Ltd.(up 0.18 per cent) and HCL Technol… [+1041 chars]",2025-07-22,neutral,-0.013611601400043583
"{'id': 'the-times-of-india', 'name': 'The Times of India'}",ETMarkets.com,Stock market update: Nifty Auto index falls 0.46% in an upbeat market,The Nifty Auto index was trading 0.46 per cent  down  at 23945.25.,https://economictimes.indiatimes.com/markets/stocks/stock-watch/stock-market-update-nifty-auto-index-falls-0-46-in-an-upbeat-market/articleshow/122827436.cms,"https://img.etimg.com/thumb/msid-82697732,width-1200,height-630,imgsize-184256,overlay-etmarkets/articleshow.jpg",2025-07-22 04:44:43+00:00,"NEW DELHI: The Nifty Auto index traded negative around 10:14AM(IST)on Tuesday in an upbeat market. Tube Investments of India Ltd.(up 1.49 per cent), Exide Industries Ltd.(up 1.2 per cent), MRF Ltd.(u… [+1113 chars]",2025-07-22,neutral,-0.00019411125640544924
"{'id': 'the-times-of-india', 'name': 'The Times of India'}",ETMarkets.com,Stock market update: Mining stocks mixed as market rises,The 30-share BSE Sensex was  up  79.19 points at 82279.53,https://economictimes.indiatimes.com/markets/stocks/stock-watch/stock-market-update-mining-stocks-mixed-as-market-rises/articleshow/122827333.cms,"https://img.etimg.com/thumb/msid-83745691,width-1200,height-630,imgsize-156851,overlay-etmarkets/articleshow.jpg",2025-07-22 04:39:36+00:00,"NEW DELHI: Mining stocks were trading mixed on Tuesday at 10:09AM Pokarna Ltd.(up 1.65%), Aro Granite Industries Ltd.(up 1.44%), Madhav Marbles &amp; Granites Ltd.(up 0.97%), KIOCL Ltd.(up 0.59%), As… [+1341 chars]",2025-07-22,negative,-0.9261645246297121
"{'id': 'the-times-of-india', 'name': 'The Times of India'}",ETMarkets.com,Stock market update: Nifty Pharma index falls 0.95% in an upbeat market,The Nifty Pharma index was trading 0.95 per cent  down  at 22317.3.,https://economictimes.indiatimes.com/markets/stocks/stock-watch/stock-market-update-nifty-pharma-index-falls-0-95-in-an-upbeat-market/articleshow/122827150.cms,"https://img.etimg.com/thumb/msid-83721067,width-1200,height-630,imgsize-421641,overlay-etmarkets/articleshow.jpg",2025-07-22 04:29:09+00:00,"NEW DELHI: The Nifty Pharma index traded negative around 09:59AM(IST)on Tuesday in an upbeat market. Natco Pharma Ltd.(up 0.98 per cent), Mankind Pharma Ltd.(up 0.31 per cent) and Abbott India Ltd.(u… [+1054 chars]",2025-07-22,neutral,-0.0010606439609546214
"{'id': 'the-times-of-india', 'name': 'The Times of India'}",ETMarkets.com,"Eternal, private banks lift Sensex 150 pts higher, Nifty over 25,100",Indian stock markets began positively. Sensex and Nifty50 saw gains driven by strong earnings reports from major lenders and Eternal (Zomato). Investors are watching for developments on a potential trade agreement with the US. Eternal's revenue jumped signifi…,https://economictimes.indiatimes.com/markets/stocks/news/eternal-private-banks-lift-sensex-150-pts-higher-nifty-over-25100/articleshow/122826693.cms,"https://img.etimg.com/thumb/msid-122826789,width-1200,height-630,imgsize-19246,overlay-etmarkets/articleshow.jpg",2025-07-22 04:01:34+00:00,"Indian benchmark indices Sensex and Nifty50 opened higher on Tuesday, buoyed by strong earnings from top private lenders and Eternal (Zomato). Investors also remained cautious ahead of a potential tr… [+1108 chars]",2025-07-22,neutral,-0.00022374066224983835
"{'id': 'the-times-of-india', 'name': 'The Times of India'}",Kshitij Anand,ETMarkets Smart Talk | FPI flows inconsistent as India’s valuation premium hits 80% over MSCI EM: Anuj Kapoor,Anuj Kapoor of JM Financial Services shares insights on Indian equity markets. He notes FPIs are cautious due to high valuations despite India's growth. Earnings are expected to grow healthily. Domestic investors are crucial for market stability. Sectors like…,https://economictimes.indiatimes.com/markets/expert-view/etmarkets-smart-talk-fpi-flows-inconsistent-as-indias-valuation-premium-hits-80-over-msci-em-anuj-kapoor/articleshow/122809380.cms,"https://img.etimg.com/thumb/msid-122809391,width-1200,height-630,imgsize-85518,overlay-etmarkets/articleshow.jpg",2025-07-22 03:30:00+00:00,"In this edition of ETMarkets Smart Talk, Anuj Kapoor, MD &amp; CEO, Private Wealth, JM Financial Services Ltd, shares insights on the current state of Indian equity markets and the factors influencin… [+6659 chars]",2025-07-22,negative,-0.999849500876735
"{'id': None, 'name': 'BusinessLine'}","Team BL, KS Badri Narayanan","Stock Market Live Updates 22 July 2025: Stock to buy today: ICICI Bank (₹1,465.85)","Sensex, Nifty, Share Prices LIVE: The upmove in ICICI Bank. The stock has begun the week on a strong note by rising over 2 per cent on Monday. Immediate support is at ₹1,450. Below that, ₹1,435-1,430 and then ₹1,410 are the next important supports. There is r…",https://www.thehindubusinessline.com/markets/share-market-nifty-sensex-live-updates-22nd-july-2025/article69779736.ece,https://bl-i.thgim.com/public/incoming/4jwfye/article69779741.ece/alternates/LANDSCAPE_1200/IMG_PO09_Coins_stack_2_1_O0DV9MVV.jpg,2025-07-22 01:14:52+00:00,"Coin stacks and chart graphs on a chessboard background. Horizontal composition with selective focus and copy space.
 | Photo Credit: 
 MicroStockHub
Stock Market today | Share Market Live Updates… [+1335 chars]",2025-07-22,neutral,-0.04910982705769129
"{'id': None, 'name': 'Economictimes.com'}",ET Spotlight Special,"Breakout Stocks: How to trade UPL, UTI AMC & UltraTech Cement that hit fresh 52-week high?","Indian markets rebounded on Monday after a two-day decline, with Sensex gaining over 400 points and Nifty50 closing above 25000. Realty, power, and auto stocks led the rally, while IT and FMCG stocks saw profit booking.",https://m.economictimes.com/markets/stocks/news/breakout-stocks-how-to-trade-upl-uti-amc-amp-ultratech-cement-that-hit-fresh-52-week-high/market-summary/slideshow/122816702.cms,"https://img.etimg.com/thumb/msid-122816702,width-1070,height-580,overlay-etmarkets/slideshow.jpg",2025-07-21 12:59:35+00:00,"Currently, the stock has given a 52-week high breakout with a strong bullish green candle.The potential targets for this stock are Rs 1,494 as Target 1 (T1) and Rs 1,500 as Target 2 (T2), with a stop… [+424 chars]",2025-07-21,negative,-0.9997862624877598
"{'id': 'the-times-of-india', 'name': 'The Times of India'}",ETMarkets.com,Stock market update: Nifty Auto index advances 0.67%,The Nifty Auto index closed 0.67 per cent  up  at 24055.0.,https://economictimes.indiatimes.com/markets/stocks/stock-watch/stock-market-update-nifty-auto-index-advances-0-67/articleshow/122815516.cms,"https://img.etimg.com/thumb/msid-83549420,width-1200,height-630,imgsize-22674,overlay-etmarkets/articleshow.jpg",2025-07-21 11:59:22+00:00,"NEW DELHI: The Nifty Auto index closed on a positive note on Monday. Shares of Ashok Leyland Ltd.(up 2.09 per cent), Mahindra &amp; Mahindra Ltd.(up 1.71 per cent), Exide Industries Ltd.(up 1.32 per … [+1128 chars]",2025-07-21,negative,-0.9995969934534514
"{'id': 'the-times-of-india', 'name': 'The Times of India'}",ETMarkets.com,Stock market update: Power stocks down as market rises,The 30-share BSE Sensex closed  up  442.61 points at 82200.34,https://economictimes.indiatimes.com/markets/stocks/stock-watch/stock-market-update-power-stocks-down-as-market-rises/articleshow/122815310.cms,"https://img.etimg.com/thumb/msid-82267819,width-1200,height-630,imgsize-142669,overlay-etmarkets/articleshow.jpg",2025-07-21 11:49:00+00:00,"NEW DELHI: Power shares closed higher in the Monday's session. ACME Solar Holdings Ltd.(up 3.90%), GE Vernova T&amp;D India Ltd.(up 3.36%), Ravindra Energy Ltd.(up 2.80%), Suzlon Energy Ltd.(up 2.10%… [+1601 chars]",2025-07-21,positive,0.9983915523043834
"{'id': 'the-times-of-india', 'name': 'The Times of India'}",ETMarkets.com,Stock market update: Fertilisers stocks up as market rises,The 30-share BSE Sensex closed  up  442.61 points at 82200.34,https://economictimes.indiatimes.com/markets/stocks/stock-watch/stock-market-update-fertilisers-stocks-up-as-market-rises/articleshow/122814853.cms,"https://img.etimg.com/thumb/msid-83772708,width-1200,height-630,imgsize-284734,overlay-etmarkets/articleshow.jpg",2025-07-21 11:27:55+00:00,"NEW DELHI: Fertilisers shares closed higher in the Monday's session. Paradeep Phosphates Ltd.(up 7.64%), Mangalore Chemicals &amp; Fertilizers Ltd.(up 6.01%), Rama Phosphates Ltd.(up 5.00%), Zuari Ag… [+1549 chars]",2025-07-21,neutral,-0.05510258757203701
