source,author,title,description,url,urlToImage,publishedAt,content,date,sentiment_label,sentiment_score
"{'id': 'the-times-of-india', 'name': 'The Times of India'}",ETMarkets.com,Stock market update: Mining stocks down as market falls,The 30-share BSE Sensex was  down  200.32 points at 82526.32,https://economictimes.indiatimes.com/markets/stocks/stock-watch/stock-market-update-mining-stocks-down-as-market-falls/articleshow/122872912.cms,"https://img.etimg.com/thumb/msid-77922857,width-1200,height-630,imgsize-132855,overlay-etmarkets/articleshow.jpg",2025-07-24 05:15:53+00:00,"NEW DELHI: Mining stocks were trading lower on Thursday at 10:45AM KIOCL Ltd.(up 5.08%), Ashapura Minechem Ltd.(up 2.02%), Aro Granite Industries Ltd.(up 0.69%) and Pokarna Ltd.(up 0.55%) were among … [+1368 chars]",2025-07-24,positive,0.9963068339275196
"{'id': 'the-times-of-india', 'name': 'The Times of India'}",ETMarkets.com,Stock market update: Power stocks down as market falls,The 30-share BSE Sensex was  down  164.4 points at 82562.24,https://economictimes.indiatimes.com/markets/stocks/stock-watch/stock-market-update-power-stocks-down-as-market-falls/articleshow/122872756.cms,"https://img.etimg.com/thumb/msid-77646325,width-1200,height-630,imgsize-71505,overlay-etmarkets/articleshow.jpg",2025-07-24 05:05:25+00:00,"NEW DELHI: Power stocks were trading lower on Thursday at 10:35AM PTC India Ltd.(up 5.70%), KEC International Ltd.(up 2.33%), Gujarat Industries Power Company Ltd.(up 1.01%), Hitachi Energy India Ltd… [+1626 chars]",2025-07-24,positive,0.9966113185510039
"{'id': 'the-times-of-india', 'name': 'The Times of India'}",ETMarkets.com,Stock market update: Sugar stocks up as market falls,The 30-share BSE Sensex was  down  250.47 points at 82476.17,https://economictimes.indiatimes.com/markets/stocks/stock-watch/stock-market-update-sugar-stocks-up-as-market-falls/articleshow/122872264.cms,"https://img.etimg.com/thumb/msid-81699096,width-1200,height-630,imgsize-194573,overlay-etmarkets/articleshow.jpg",2025-07-24 04:39:35+00:00,"NEW DELHI: Sugar stocks were trading higher on Thursday at 10:09AM Balrampur Chini Mills Ltd.(up 1.58%), Simbhaoli Sugars Ltd.(up 1.38%), Sakthi Sugars Ltd.(up 1.13%), DCM Shriram Industries Ltd.(up … [+1707 chars]",2025-07-24,negative,-0.9835199595836457
"{'id': 'the-times-of-india', 'name': 'The Times of India'}",ETMarkets.com,"Sensex drops 100 pts, Nifty below 25,250; IT, bank stocks tumble","Indian stock markets started the day on a slightly negative note. Banking and IT sectors experienced some downward pressure. However, positive expectations surrounding a potential free trade agreement between India and the UK provided some support. Investors …",https://economictimes.indiatimes.com/markets/stocks/news/sensex-drops-100-pts-nifty-below-25200-it-bank-stocks-tumble/articleshow/122871468.cms,"https://img.etimg.com/thumb/msid-122871463,width-1200,height-630,imgsize-16174,overlay-etmarkets/articleshow.jpg",2025-07-24 03:58:36+00:00,"Indian benchmark indices opened slightly lower on Thursday, weighed down by banking and IT stocks, even as sentiment remained supported by optimism over a potential free-trade agreement with the UK.A… [+1233 chars]",2025-07-24,positive,0.9999413443329104
"{'id': None, 'name': 'BusinessLine'}","KS Badri Narayanan, Team BL","Stock Market Highlights 24 July 2025: Sensex tumbles over 500 points on profit-taking in blue-chips, foreign fund outflows","Sensex, Nifty, Share Price: Equity markets fell on Thursday, with the benchmark Sensex tumbling 542.47 points, amid profit-taking in blue-chip stocks and foreign fund outflows.
Despite a positive start, the 30-share BSE Sensex failed to carry forward the mome…",https://www.thehindubusinessline.com/markets/share-market-nifty-sensex-updates-24-july-2025/article69847004.ece,https://bl-i.thgim.com/public/incoming/kc251p/article69836981.ece/alternates/LANDSCAPE_1200/PO16_Rising_chart.jpg,2025-07-24 00:59:25+00:00,"Stock Market Today | Share Market Updates - Find here all the updates related to Sensex, Nifty, BSE, NSE share prices and Indian stock markets for 24 July 2025.<li></li>
17:03 | July 24, 2025Stock m… [+82143 chars]",2025-07-24,positive,0.9999102953006513
"{'id': None, 'name': 'BusinessLine'}",BL Research Bureau,"Day Trading Guide for July 24, 2025: Intraday supports, resistances for Nifty50 stocks","Day Trading Guide gives you the key intraday supports and resistances to watch out for on the Nifty Futures and other widely traded stocks such as Reliance Industries, Infosys, HDFC Bank, TCS, SBI",https://www.thehindubusinessline.com/portfolio/day-trading-guide/day-trading-guide-for-july-24/article69846388.ece,https://bl-i.thgim.com/public/incoming/84khnm/article69711880.ece/alternates/LANDSCAPE_1200/PO16_Buy_sell_dice.jpg,2025-07-24 00:30:00+00:00,"Day trading guide gives you the key intraday supports and resistances to watch out for on the Nifty futures and other widely traded stocks such as Reliance Industries, Infosys, HDFC Bank, TCS, and SB… [+2336 chars]",2025-07-24,negative,-0.9999945118224787
"{'id': 'the-times-of-india', 'name': 'The Times of India'}",ETMarkets.com,Stock market update: FMCG stocks down as market rises,The 30-share BSE Sensex closed  up  539.83 points at 82726.64,https://economictimes.indiatimes.com/markets/stocks/stock-watch/stock-market-update-fmcg-stocks-down-as-market-rises/articleshow/122859627.cms,"https://img.etimg.com/thumb/msid-83209716,width-1200,height-630,imgsize-107089,overlay-etmarkets/articleshow.jpg",2025-07-23 11:53:22+00:00,"NEW DELHI: FMCG shares closed higher in the Wednesday's session. Parag Milk Foods Ltd.(up 4.32%), Bikaji Foods International Ltd.(up 3.39%), Bajaj Consumer Care Ltd.(up 1.97%), Zydus Wellness Ltd.(up… [+1620 chars]",2025-07-23,positive,0.9903153628110886
"{'id': 'the-times-of-india', 'name': 'The Times of India'}",ETMarkets.com,Stock market update: Power stocks down as market rises,The 30-share BSE Sensex closed  up  539.83 points at 82726.64,https://economictimes.indiatimes.com/markets/stocks/stock-watch/stock-market-update-power-stocks-down-as-market-rises/articleshow/122858994.cms,"https://img.etimg.com/thumb/msid-82697732,width-1200,height-630,imgsize-184256,overlay-etmarkets/articleshow.jpg",2025-07-23 11:27:14+00:00,"NEW DELHI: Power shares closed higher in the Wednesday's session. Reliance Power Ltd.(up 2.55%), Adani Green Energy Ltd.(up 2.00%), GE Vernova T&amp;D India Ltd.(up 2.00%), Power and Instrumentation(… [+1675 chars]",2025-07-23,positive,0.9983915523043834
"{'id': None, 'name': 'Economictimes.com'}",ET Spotlight Special,"Breakout Stocks: How to trade M&M, Paytm and L&T Finance that hit fresh 52-week high?","Indian markets rebounded sharply on Wednesday, with Sensex surging over 500 points and Nifty50 ending above 25,200. Gains were driven by energy, banks, telecom and auto, while FMCG and realty stocks faced selling. Several stocks hit fresh 52-week highs.",https://m.economictimes.com/markets/stocks/news/breakout-stocks-how-to-trade-mampm-paytm-and-lampt-finance-that-hit-fresh-52-week-high/market-summary/slideshow/122858896.cms,"https://img.etimg.com/thumb/msid-122858896,width-1070,height-580,overlay-etmarkets/slideshow.jpg",2025-07-23 11:16:30+00:00,"L&amp;T Finance has broken out of a bullish cup and handle pattern on the 60-minute timeframe. The upside resistance levels are now at 217 and 220, with support at 208.
(Disclaimer: Recommendations,… [+120 chars]",2025-07-23,negative,-0.999948737286104
"{'id': 'the-times-of-india', 'name': 'The Times of India'}",ETMarkets.com,Stock market update: Fertilisers stocks up as market rises,The 30-share BSE Sensex closed  up  539.83 points at 82726.64,https://economictimes.indiatimes.com/markets/stocks/stock-watch/stock-market-update-fertilisers-stocks-up-as-market-rises/articleshow/122858171.cms,"https://img.etimg.com/thumb/msid-81699096,width-1200,height-630,imgsize-194573,overlay-etmarkets/articleshow.jpg",2025-07-23 10:51:03+00:00,"NEW DELHI: Fertilisers shares closed higher in the Wednesday's session. Paradeep Phosphates Ltd.(up 5.57%), Mangalore Chemicals &amp; Fertilizers Ltd.(up 3.97%), Bohra Industries Ltd.(up 3.62%), Sout… [+1817 chars]",2025-07-23,neutral,-0.05510258757203701
"{'id': 'the-times-of-india', 'name': 'The Times of India'}",ETMarkets.com,Stock market update: FMCG stocks down as market rises,The 30-share BSE Sensex was  up  191.16 points at 82377.97,https://economictimes.indiatimes.com/markets/stocks/stock-watch/stock-market-update-fmcg-stocks-down-as-market-rises/articleshow/122851584.cms,"https://img.etimg.com/thumb/msid-83608600,width-1200,height-630,imgsize-23742,overlay-etmarkets/articleshow.jpg",2025-07-23 05:52:28+00:00,"NEW DELHI: FMCG stocks were trading lower on Wednesday at 11:22AM Zydus Wellness Ltd.(up 1.72%), Hatsun Agro Products Ltd.(up 1.63%), Nakoda Group Of Industries Ltd.(up 1.33%), Nakoda Group Of Indust… [+1627 chars]",2025-07-23,positive,0.9903153628110886
"{'id': 'the-times-of-india', 'name': 'The Times of India'}",ETMarkets.com,Stock market update: Mining stocks up as market rises,The 30-share BSE Sensex was  up  236.61 points at 82423.42,https://economictimes.indiatimes.com/markets/stocks/stock-watch/stock-market-update-mining-stocks-up-as-market-rises/articleshow/122851468.cms,"https://img.etimg.com/thumb/msid-82267819,width-1200,height-630,imgsize-142669,overlay-etmarkets/articleshow.jpg",2025-07-23 05:47:06+00:00,"NEW DELHI: Mining stocks were trading higher on Wednesday at 11:16AM KIOCL Ltd.(up 9.05%), Ashapura Minechem Ltd.(up 2.99%), 20 Microns Ltd.(up 2.62%), Gujarat Mineral Development Corporation Ltd.(up… [+1379 chars]",2025-07-23,neutral,-0.004014043531867628
"{'id': 'the-times-of-india', 'name': 'The Times of India'}",ETMarkets.com,Stock market update: Sugar stocks down as market rises,The 30-share BSE Sensex was  up  216.4 points at 82403.21,https://economictimes.indiatimes.com/markets/stocks/stock-watch/stock-market-update-sugar-stocks-down-as-market-rises/articleshow/122851142.cms,"https://img.etimg.com/thumb/msid-83608600,width-1200,height-630,imgsize-23742,overlay-etmarkets/articleshow.jpg",2025-07-23 05:31:16+00:00,"NEW DELHI: Sugar stocks were trading lower on Wednesday at 11:01AM Piccadily Agro Industries Ltd.(up 0.45%), EID Parry(India)Ltd.(up 0.34%), Uttam Sugar Mills Ltd.(up 0.20%), Balrampur Chini Mills Lt… [+1514 chars]",2025-07-23,positive,0.9470499511808157
"{'id': 'the-times-of-india', 'name': 'The Times of India'}",ETMarkets.com,Stock market update: Fertilisers stocks up as market rises,The 30-share BSE Sensex was  up  151.06 points at 82337.87,https://economictimes.indiatimes.com/markets/stocks/stock-watch/stock-market-update-fertilisers-stocks-up-as-market-rises/articleshow/122850739.cms,"https://img.etimg.com/thumb/msid-83209716,width-1200,height-630,imgsize-107089,overlay-etmarkets/articleshow.jpg",2025-07-23 05:10:28+00:00,"NEW DELHI: Fertilisers stocks were trading higher on Wednesday at 10:40AM Paradeep Phosphates Ltd.(up 5.23%), Mangalore Chemicals &amp; Fertilizers Ltd.(up 2.99%), Khaitan Chemicals &amp; Fertilizers… [+1793 chars]",2025-07-23,neutral,-0.05510258757203701
"{'id': 'the-times-of-india', 'name': 'The Times of India'}",ETMarkets.com,Stock market update: Power stocks down as market rises,The 30-share BSE Sensex was  up  150.26 points at 82337.07,https://economictimes.indiatimes.com/markets/stocks/stock-watch/stock-market-update-power-stocks-down-as-market-rises/articleshow/122850363.cms,"https://img.etimg.com/thumb/msid-82267819,width-1200,height-630,imgsize-142669,overlay-etmarkets/articleshow.jpg",2025-07-23 04:49:51+00:00,"NEW DELHI: Power stocks were trading lower on Wednesday at 10:19AM Karma Energy Ltd.(up 2.10%), Adani Green Energy Ltd.(up 2.06%), Ravindra Energy Ltd.(up 1.53%), NLC India Ltd.(up 1.10%), Power and … [+1634 chars]",2025-07-23,positive,0.9983915523043834
"{'id': 'the-times-of-india', 'name': 'The Times of India'}",ETMarkets.com,"Sensex jumps over 250 pts, Nifty tops 25,100 on strong global cues after US-Japan trade deal","Indian benchmark indices Sensex and Nifty50 opened higher, buoyed by gains in Asian markets following the U.S.-Japan trade deal. Investor sentiment improved, fueled by hopes of further trade agreements and upcoming U.S.-China talks. However, optimism regardin…",https://economictimes.indiatimes.com/markets/stocks/news/sensex-jumps-over-250-pts-nifty-tops-25100-on-strong-global-cues-after-us-japan-trade-deal/articleshow/122849535.cms,"https://img.etimg.com/thumb/msid-122849528,width-1200,height-630,imgsize-14158,overlay-etmarkets/articleshow.jpg",2025-07-23 03:58:42+00:00,"Indian benchmark indices Sensex and Nifty50 opened higher on Wednesday, following gains in Asian markets after the United States announced a trade deal with Japan, raising hopes of more such agreemen… [+2940 chars]",2025-07-23,neutral,-6.626154958055963e-09
"{'id': None, 'name': 'Ndtvprofit.com'}",NDTV Profit News,Dodla Dairy Targets 15% CAGR Topline Growth In Next Five Years: MD Sunil Reddy,The company expects to maintain Ebitda Margins of 8-10% in FY26.,https://www.ndtvprofit.com/business/dodla-dairy-targets-15-cagr-topline-growth-in-next-five-years-md-sunil-reddy,https://media.assettype.com/bloombergquint%2F2025-02-01%2Fzotmpycr%2Fphoto-1550583724-b2692b85b150.avif?w=1200&auto=format%2Ccompress&ogImage=true,2025-07-23 01:42:11+00:00,Dodla Dairy is aiming for a double-digit growth in revenue in the current financial year with Ebitda margins of 8 to 10%. The Hyderabad-based milk products company expects its revenue to grow by 15% … [+2269 chars],2025-07-23,neutral,-0.0067008071243321865
"{'id': None, 'name': 'BusinessLine'}","Team BL, KS Badri Narayanan",Stock Market Live Updates 23 July 2025: Stock to buy today: Akzo Nobel India,"Sensex, Nifty, Share Prices LIVE: The outlook for Akzo Nobel India is bullish. The 5 per cent rise seen so far this week confirms a bullish breakout. There is a double-bottom reversal pattern on the chart. Moving average crossovers also strengthens the bullis…",https://www.thehindubusinessline.com/markets/share-market-nifty-sensex-live-updates-23-july-2025/article69845067.ece,https://bl-i.thgim.com/public/incoming/fm3ksv/article69567354.ece/alternates/LANDSCAPE_1200/IMG_PO09_Coins_stack_2_1_O0DV9MVV.jpg,2025-07-23 01:23:36+00:00,"Coin stacks and chart graphs on a chessboard background. Horizontal composition with selective focus and copy space.
 | Photo Credit: 
 MicroStockHub
Stock Market today | Share Market Live Updates… [+2179 chars]",2025-07-23,neutral,-0.013595744451095015
"{'id': None, 'name': 'BusinessLine'}","Team BL, KS Badri Narayanan","Stock Market Highlights 23 July 2025: Sensex, Nifty close firm on optimism over global trade developments","Sensex, Nifty, Share Prices: Markets staged a strong recovery on Wednesday, with the Nifty 50 closing above its crucial 20-day exponential moving average for the first time since July 11, as optimism over global trade developments and selective sectoral stren…",https://www.thehindubusinessline.com/markets/share-market-nifty-sensex-highlights-23-july-2025/article69845067.ece,https://bl-i.thgim.com/public/incoming/fm3ksv/article69567354.ece/alternates/LANDSCAPE_1200/IMG_PO09_Coins_stack_2_1_O0DV9MVV.jpg,2025-07-23 01:23:36+00:00,"Stock Market today | Share Market Updates - Find here all the updates related to Sensex, Nifty, BSE, NSE, share prices and Indian stock markets for 23 July 2025 <li></li>
16:56 | July 23, 2025Stock … [+62081 chars]",2025-07-23,neutral,-0.16722407878842205
"{'id': None, 'name': 'Economictimes.com'}",ET Spotlight Special,"Breakout Stocks: How to trade Eternal, The Ramco Cement & ICICI Bank that hit 52-week high?","Indian equities closed slightly in the red on Tuesday amid mixed global cues. While Nifty50 held the 25,000 mark, sectoral divergence showed buying in momentum stocks but pressure on healthcare, auto, telecom, and realty counters.",https://m.economictimes.com/markets/stocks/news/breakout-stocks-how-to-trade-eternal-the-ramco-cement-amp-icici-bank-that-hit-52-week-high/market-summary/slideshow/122837673.cms,"https://img.etimg.com/thumb/msid-122837673,width-1070,height-580,overlay-etmarkets/slideshow.jpg",2025-07-22 12:07:14+00:00,In the last few weeks this stock has been consolidating in the band of roughly 1400-1470. It is now showing some strength to give a breakout on the higher side.Once it starts sustaining above the hig… [+309 chars],2025-07-22,negative,-0.9999700221897001
"{'id': 'the-times-of-india', 'name': 'The Times of India'}",ETMarkets.com,Stock market update: Fertilisers stocks up as market falls,The 30-share BSE Sensex closed  down  13.53 points at 82186.81,https://economictimes.indiatimes.com/markets/stocks/stock-watch/stock-market-update-fertilisers-stocks-up-as-market-falls/articleshow/122836334.cms,"https://img.etimg.com/thumb/msid-83769615,width-1200,height-630,imgsize-98874,overlay-etmarkets/articleshow.jpg",2025-07-22 11:17:28+00:00,"NEW DELHI: Fertilisers shares closed lower in the Tuesday's session. Bohra Industries Ltd.(up 4.78%), Paradeep Phosphates Ltd.(up 2.85%), Sikko Industries Ltd.(up 2.60%), Rama Phosphates Ltd.(up 2.00… [+1859 chars]",2025-07-22,negative,-0.9825689722783864
"{'id': 'the-times-of-india', 'name': 'The Times of India'}",ETMarkets.com,Stock market update: Power stocks down as market falls,The 30-share BSE Sensex closed  down  13.53 points at 82186.81,https://economictimes.indiatimes.com/markets/stocks/stock-watch/stock-market-update-power-stocks-down-as-market-falls/articleshow/122835831.cms,"https://img.etimg.com/thumb/msid-83608600,width-1200,height-630,imgsize-23742,overlay-etmarkets/articleshow.jpg",2025-07-22 10:56:18+00:00,"NEW DELHI: Power shares closed lower in the Tuesday's session. Ravindra Energy Ltd.(up 5.00%), NLC India Ltd.(up 4.81%), Hitachi Energy India Ltd.(up 4.44%), GE Power India Ltd.(up 2.38%), Transrail … [+1645 chars]",2025-07-22,positive,0.9966113185510039
"{'id': 'the-times-of-india', 'name': 'The Times of India'}",ETMarkets.com,Stock market update: Mining stocks up as market falls,The 30-share BSE Sensex closed  down  13.53 points at 82186.81,https://economictimes.indiatimes.com/markets/stocks/stock-watch/stock-market-update-mining-stocks-up-as-market-falls/articleshow/122835699.cms,"https://img.etimg.com/thumb/msid-83725308,width-1200,height-630,imgsize-48184,overlay-etmarkets/articleshow.jpg",2025-07-22 10:51:02+00:00,"NEW DELHI: Mining shares closed lower in the Tuesday's session. 20 Microns Ltd.(up 6.10%), Gujarat Mineral Development Corporation Ltd.(up 4.97%), Madhav Marbles &amp; Granites Ltd.(up 3.43%), MOIL L… [+1391 chars]",2025-07-22,negative,-0.927168727881508
"{'id': 'the-times-of-india', 'name': 'The Times of India'}",ETMarkets.com,Stock market update: FMCG stocks down as market falls,The 30-share BSE Sensex closed  down  13.53 points at 82186.81,https://economictimes.indiatimes.com/markets/stocks/stock-watch/stock-market-update-fmcg-stocks-down-as-market-falls/articleshow/122835002.cms,"https://img.etimg.com/thumb/msid-83209716,width-1200,height-630,imgsize-107089,overlay-etmarkets/articleshow.jpg",2025-07-22 10:30:16+00:00,"NEW DELHI: FMCG shares closed lower in the Tuesday's session. Vadilal Industries Ltd.(up 1.94%), Bikaji Foods International Ltd.(up 1.67%), Euro India Fresh Foods Ltd.(up 1.45%), Nakoda Group Of Indu… [+1631 chars]",2025-07-22,positive,0.9651656225323677
"{'id': 'the-times-of-india', 'name': 'The Times of India'}",Riya Sharma,"Eternal tops Rs 3 lakh crore market cap, surpasses Wipro, Tata Motors & other Nifty50 giants","Eternal m-cap: The stock surged up to 15% to reach a record high of ₹311.6 on the BSE, before trimming gains to trade 8.8% higher at ₹295.10 by late morning. The sharp rise followed investor enthusiasm over Blinkit’s stellar June-quarter results—Eternal’s qui…",https://economictimes.indiatimes.com/tech/startups/eternal-tops-rs-3-lakh-crore-market-cap-surpasses-wipro-tata-motors-other-nifty50-giants/articleshow/122835522.cms,"https://img.etimg.com/thumb/width-1200,height-900,imgsize-75248,resizemode-75,msid-122835522/tech/startups/eternal-tops-rs-3-lakh-crore-market-cap-surpasses-wipro-tata-motors-other-nifty50-giants.jpg",2025-07-22 06:43:38+00:00,"Eternal Ltd shares jumped to a record high of Rs 311.6 on Tuesday, pushing the Zomato and Blinkit parents market capitalisation past Rs 3 lakh croresurpassing several prominent Nifty 50 constituents,… [+3251 chars]",2025-07-22,negative,-0.9996606095446623
"{'id': 'the-times-of-india', 'name': 'The Times of India'}",Riya Sharma,"Eternal tops Rs 3 lakh crore market cap, surpasses Wipro, Tata Motors & other Nifty50 giants","Eternal m-cap: The stock surged up to 15% to reach a record high of ₹311.6 on the BSE, before trimming gains to trade 8.8% higher at ₹295.10 by late morning. The sharp rise followed investor enthusiasm over Blinkit’s stellar June-quarter results—Eternal’s qui…",https://economictimes.indiatimes.com/markets/stocks/news/eternal-tops-rs-3-lakh-crore-market-cap-surpasses-wipro-tata-motors-other-nifty50-giants/articleshow/122829826.cms,"https://img.etimg.com/thumb/msid-122830115,width-1200,height-630,imgsize-75248,overlay-etmarkets/articleshow.jpg",2025-07-22 06:43:38+00:00,"Eternal Ltd shares jumped to a record high of Rs 311.6 on Tuesday, pushing the Zomato and Blinkit parents market capitalisation past Rs 3 lakh croresurpassing several prominent Nifty 50 constituents,… [+3315 chars]",2025-07-22,negative,-0.9996606095446623
"{'id': 'the-times-of-india', 'name': 'The Times of India'}",ETMarkets.com,Stock market update: FMCG stocks down as market falls,The 30-share BSE Sensex was  down  19.2 points at 82181.14,https://economictimes.indiatimes.com/markets/stocks/stock-watch/stock-market-update-fmcg-stocks-down-as-market-falls/articleshow/122828865.cms,"https://img.etimg.com/thumb/msid-82697732,width-1200,height-630,imgsize-184256,overlay-etmarkets/articleshow.jpg",2025-07-22 05:58:19+00:00,"NEW DELHI: FMCG stocks were trading lower on Tuesday at 11:28AM Nakoda Group Of Industries Ltd.(up 2.06%), Nakoda Group Of Industries Ltd.(up 2.06%), Vadilal Industries Ltd.(up 1.95%), Gillette India… [+1626 chars]",2025-07-22,positive,0.9651656225323677
"{'id': 'the-times-of-india', 'name': 'The Times of India'}",ETMarkets.com,Stock market update: Power stocks down as market rises,The 30-share BSE Sensex was  up  0.26 points at 82200.6,https://economictimes.indiatimes.com/markets/stocks/stock-watch/stock-market-update-power-stocks-down-as-market-rises/articleshow/122828458.cms,"https://img.etimg.com/thumb/msid-81699096,width-1200,height-630,imgsize-194573,overlay-etmarkets/articleshow.jpg",2025-07-22 05:37:14+00:00,"NEW DELHI: Power stocks were trading lower on Tuesday at 11:07AM Ravindra Energy Ltd.(up 4.38%), Hitachi Energy India Ltd.(up 2.70%), GE Power India Ltd.(up 1.52%), NLC India Ltd.(up 1.19%), Kalpatar… [+1572 chars]",2025-07-22,positive,0.9983915523043834
"{'id': 'the-times-of-india', 'name': 'The Times of India'}",ETMarkets.com,Sensex rises! These stocks are up over 15% on BSE,"In the Nifty50 index, 16 stocks were trading in the green, while 34 stocks were in the red.",https://economictimes.indiatimes.com/markets/stocks/stock-watch/sensex-rises-these-stocks-are-up-over-15-on-bse/articleshow/122828247.cms,"https://img.etimg.com/thumb/msid-83745691,width-1200,height-630,imgsize-156851,overlay-etmarkets/articleshow.jpg",2025-07-22 05:26:54+00:00,"NEW DELHI: Several stocks gained in excess of 15% in Mumbai trading on Tuesday even as equity benchmarks, BSE Sensex and NSE Nifty, traded in the red amid brisk selling in frontline bluechip counters… [+750 chars]",2025-07-22,neutral,-0.0003200856037040012
"{'id': 'the-times-of-india', 'name': 'The Times of India'}",ETMarkets.com,Stock market update: Sugar stocks up as market rises,The 30-share BSE Sensex was  up  88.41 points at 82288.75,https://economictimes.indiatimes.com/markets/stocks/stock-watch/stock-market-update-sugar-stocks-up-as-market-rises/articleshow/122828119.cms,"https://img.etimg.com/thumb/msid-83791939,width-1200,height-630,imgsize-992893,overlay-etmarkets/articleshow.jpg",2025-07-22 05:21:34+00:00,"NEW DELHI: Sugar stocks were trading higher on Tuesday at 10:51AM Piccadily Agro Industries Ltd.(up 1.82%), Shree Renuka Sugars Ltd.(up 1.28%), Triveni Engineering &amp; Industries Ltd.(up 1.19%), Ba… [+1699 chars]",2025-07-22,neutral,-0.06233912489187787
"{'id': 'the-times-of-india', 'name': 'The Times of India'}",ETMarkets.com,Stock market update: Nifty Bank index advances 0.27% in an upbeat market,The Nifty Bank index was trading 0.27 per cent  up  at 57106.2.,https://economictimes.indiatimes.com/markets/stocks/stock-watch/stock-market-update-nifty-bank-index-advances-0-27-in-an-upbeat-market/articleshow/122827649.cms,"https://img.etimg.com/thumb/msid-83769615,width-1200,height-630,imgsize-98874,overlay-etmarkets/articleshow.jpg",2025-07-22 04:55:19+00:00,"NEW DELHI: The Nifty Bank index traded positive around 10:25AM(IST)on Tuesday in an upbeat market. ICICI Bank Ltd.(up 1.04 per cent), HDFC Bank Ltd.(up 0.87 per cent), Axis Bank Ltd.(up 0.63 per cent… [+1062 chars]",2025-07-22,neutral,-2.2789856842564404e-05
